{
  "schema": "gentle-ai.work-capabilities/v2",
  "contract": "gentle-ai.work-capabilities/v2",
  "repositoryRef": "sha256:aaaaaaaaaaaaaaaaaaaaaaaaaaaaaaaaaaaaaaaaaaaaaaaaaaaaaaaaaaaaaaaa",
  "agentId": "pi",
  "workRouting": {
    "id": "gentle-ai.work-routing/v1",
    "exposure": "dormant",
    "implementationRouting": {
      "directInline": {
        "minUnderstandingFiles": 1,
        "maxUnderstandingFiles": 3,
        "maxMechanicalWriteFiles": 1,
        "mechanicalWriteMustBeAlreadyUnderstood": true,
        "mechanicalWriteMustNotRequireResearch": true,
        "mechanicalWriteMustNotHaveOpenDesignWork": true
      },
      "delegatedDirect": {
        "mappingMinUnderstandingFiles": 4,
        "writerMinNonTrivialFiles": 2,
        "delegateWhenReadPreparesWrite": true,
        "delegateWhenBroadResearch": true
      },
      "sdd": {
        "proposeWhenSubstantialOrAmbiguous": true,
        "durableArtifactsMustReduceUncertainty": true,
        "selectionPolicy": "explicit_request_or_accepted_proposal"
      }
    }
  },
  "contracts": {
    "start": "gentle-ai.work-start/v1",
    "route": "gentle-ai.work-route/v1",
    "advance": "gentle-ai.work-advance/v2",
    "verificationDecide": "gentle-ai.work-verification-decide/v1",
    "reconcile": "gentle-ai.work-reconcile/v1",
    "status": "gentle-ai.work-status/v1",
    "transition": "gentle-ai.work-transition/v1"
  }
}
